name,rating,review,date,attraction,address,latitude,longitude
Sagor Das, 5 stars ,nice place with relaxing environment  this lake is directly connected with the sea  can have a wider view from the watch tower with coffee,9 months ago,청초호호수공원,강원도 속초시 교동 엑스포로 140,38.1958405,128.5802796
CROWN VALVE, 5 stars ,such a nice view,4 months ago,청초호호수공원,강원도 속초시 교동 엑스포로 140,38.1958405,128.5802796
Gde Sagita, 4 stars ,great lake side park,3 years ago,청초호호수공원,강원도 속초시 교동 엑스포로 140,38.1958405,128.5802796
Juliet Oluchi, 5 stars ,beautiful place,a year ago,청초호호수공원,강원도 속초시 교동 엑스포로 140,38.1958405,128.5802796
Emerson, 5 stars ,soo good,3 years ago,청초호호수공원,강원도 속초시 교동 엑스포로 140,38.1958405,128.5802796
Min S, 5 stars ,very salty lake,4 years ago,청초호호수공원,강원도 속초시 교동 엑스포로 140,38.1958405,128.5802796
Wunk Zu, 5 stars ,the perfect place to relax and unwind     tempat yang pas untuk santai dan melepaskan penat,2 years ago,청초호호수공원,강원도 속초시 교동 엑스포로 140,38.1958405,128.5802796
Jan-Michael Buckowitz, 4 stars ,in the heat always a cool breeze  if you sit in the summer under the roof of the pavilion  evening is the jetty and the pavilion lit up atmospherically  the only but significant drawback is the horrible odor of human excrement  which is unfortunately still partly reaching the brackwassersee here and elsewhere  given the prevailing wind and water currents      bei  hitze immer eine k hle brise  wenn man im sommer unter dem dach des pavillons sitzt  abend ist der steg und der pavillon stimmungsvoll beleuchtet  einziger und doch markanter wermutstropfen ist der bei entsprechenden wind  und wasserstr mungsverh ltnissen entsetzliche geruch nach menschlichen exkrementen  die leider immer noch teilweise in den brackwassersee hier und an einer anderen stelle gelangen,3 years ago,청초호호수공원,강원도 속초시 교동 엑스포로 140,38.1958405,128.5802796
